{
  "schema": "earthsciio/cache-case/v1",
  "id": "named-window-mixed-rank",
  "loader": "geosfp",
  "kind": "grid",
  "format": "netcdf",
  "transport": "file",
  "store": "local",
  "resolved_url": "https://data.earthsci.dev/geosfp/mini/GEOSFP.20240101.A3mixed.nc",
  "cache_key": "15b37e1c2dae8dea65eedaab68c5df8f15f007a396dd7b07992ec989588c8aef",
  "blob_path": "cache/v1/blobs/15/15b37e1c2dae8dea65eedaab68c5df8f15f007a396dd7b07992ec989588c8aef.nc",
  "manifest_path": "cache/v1/meta/15b37e1c2dae8dea65eedaab68c5df8f15f007a396dd7b07992ec989588c8aef.json",
  "content_sha256": "292638386e19ce6b969a4f12092e5acbe903ac42c82d224d700a073e589c88b9",
  "bytes": 2216,
  "select": {
    "dims": {
      "lat": {
        "slice": [
          1,
          3
        ]
      },
      "lon": {
        "indices": [
          4,
          0,
          2
        ]
      },
      "lev": {
        "slice": [
          0,
          3,
          2
        ]
      },
      "lon_edge": {
        "slice": [
          2,
          5
        ]
      }
    }
  },
  "decode": {
    "scale_factor_offset": true,
    "fill_to_nan": true,
    "time_decoded": false,
    "decode_time_select": true,
    "select_form": "dims"
  },
  "expected": {
    "variables": {
      "T": {
        "dtype": "float64",
        "dims": [
          "time",
          "lev",
          "lat",
          "lon"
        ],
        "shape": [
          2,
          2,
          2,
          3
        ],
        "fill_value": null,
        "data": [
          [
            [
              [
                250.14,
                250.1,
                250.12
              ],
              [
                250.24,
                250.2,
                250.22
              ]
            ],
            [
              [
                252.14,
                252.1,
                252.12
              ],
              [
                252.24,
                252.2,
                252.22
              ]
            ]
          ],
          [
            [
              [
                260.14,
                260.1,
                260.12
              ],
              [
                260.24,
                260.2,
                260.22
              ]
            ],
            [
              [
                262.14,
                262.1,
                262.12
              ],
              [
                null,
                262.2,
                262.22
              ]
            ]
          ]
        ]
      },
      "PS": {
        "dtype": "float64",
        "dims": [
          "time",
          "lat",
          "lon"
        ],
        "shape": [
          2,
          2,
          3
        ],
        "fill_value": null,
        "data": [
          [
            [
              100014.0,
              100010.0,
              100012.0
            ],
            [
              100024.0,
              100020.0,
              100022.0
            ]
          ],
          [
            [
              101014.0,
              101010.0,
              101012.0
            ],
            [
              101024.0,
              101020.0,
              101022.0
            ]
          ]
        ]
      },
      "U_EDGE": {
        "dtype": "float64",
        "dims": [
          "time",
          "lat",
          "lon_edge"
        ],
        "shape": [
          2,
          2,
          3
        ],
        "fill_value": null,
        "data": [
          [
            [
              12.5,
              13.5,
              14.5
            ],
            [
              22.5,
              23.5,
              24.5
            ]
          ],
          [
            [
              1012.5,
              1013.5,
              1014.5
            ],
            [
              1022.5,
              1023.5,
              1024.5
            ]
          ]
        ]
      },
      "PHIS": {
        "dtype": "float64",
        "dims": [
          "lat",
          "lon"
        ],
        "shape": [
          2,
          3
        ],
        "fill_value": null,
        "data": [
          [
            14.25,
            10.25,
            12.25
          ],
          [
            24.25,
            20.25,
            22.25
          ]
        ]
      },
      "AREA_LAT": {
        "dtype": "float64",
        "dims": [
          "lat"
        ],
        "shape": [
          2
        ],
        "fill_value": null,
        "data": [
          20.0,
          30.0
        ]
      }
    },
    "coords": {
      "time": {
        "dtype": "int32",
        "data": [
          0,
          3
        ],
        "units": "hours since 2024-01-01 00:00:00",
        "calendar": "standard"
      },
      "lev": {
        "dtype": "float64",
        "data": [
          1.0,
          3.0
        ]
      },
      "lat": {
        "dtype": "float64",
        "data": [
          -0.5,
          0.5
        ]
      },
      "lon": {
        "dtype": "float64",
        "data": [
          288.0,
          0.0,
          144.0
        ]
      },
      "lon_edge": {
        "dtype": "float64",
        "data": [
          108.0,
          180.0,
          252.0
        ]
      }
    }
  },
  "notes": "GEOS-FP-shaped blob with fields of rank 1 (AREA_LAT[lat]), 2 (PHIS[lat,lon]), 3 (PS[time,lat,lon] AND U_EDGE[time,lat,lon_edge] on the STAGGERED lon_edge) and 4 (T[time,lev,lat,lon], int16-packed with one masked cell inside the window), read through ONE named-dimension select (spec/prefetch.md 2.1): lat {slice:[1,3]}, lon {indices:[4,0,2]} (permuted), lev {slice:[0,3,2]} (stepped), lon_edge {slice:[2,5]}; time unnamed, so whole and raw. No positional `axes` can say this: rank 3 is [time,lat,lon] for PS and [time,lat,lon_edge] for U_EDGE. Every field and every coordinate carrying a named dim is sliced by name; the expectation is the full read sliced afterwards."
}
