{
  "schema": "earthsciio/cache-case/v1",
  "id": "openaq-points-slice",
  "loader": "openaq",
  "kind": "points",
  "format": "csv",
  "transport": "file",
  "store": "local",
  "resolved_url": "https://openaq-data-archive.s3.amazonaws.com/records/openaq/locationid=1/2018-11-08.csv",
  "cache_key": "69dd26b950e43cb2182e3b4d02e89e09bfb798b13469183ca2dad15c5794379a",
  "blob_path": "cache/v1/blobs/69/69dd26b950e43cb2182e3b4d02e89e09bfb798b13469183ca2dad15c5794379a.csv",
  "manifest_path": "cache/v1/meta/69dd26b950e43cb2182e3b4d02e89e09bfb798b13469183ca2dad15c5794379a.json",
  "content_sha256": "e39fd26f37e1355dbb9e36d1cebfc8149bd073b12bfe31803d06fbbf97c0f8d7",
  "bytes": 276,
  "select": {
    "all_rows": true
  },
  "decode": {
    "delimiter": ",",
    "header_row": 0,
    "numeric_columns": [
      "latitude",
      "longitude",
      "value"
    ]
  },
  "expected": {
    "variables": {
      "location_id": {
        "dtype": "string",
        "dims": [
          "index"
        ],
        "shape": [
          4
        ],
        "fill_value": null,
        "data": [
          "1",
          "1",
          "2",
          "2"
        ]
      },
      "datetime": {
        "dtype": "string",
        "dims": [
          "index"
        ],
        "shape": [
          4
        ],
        "fill_value": null,
        "data": [
          "2018-11-08T00:00:00Z",
          "2018-11-08T01:00:00Z",
          "2018-11-08T00:00:00Z",
          "2018-11-08T01:00:00Z"
        ]
      },
      "latitude": {
        "dtype": "float64",
        "dims": [
          "index"
        ],
        "shape": [
          4
        ],
        "fill_value": null,
        "data": [
          39.76,
          39.76,
          39.5,
          39.5
        ]
      },
      "longitude": {
        "dtype": "float64",
        "dims": [
          "index"
        ],
        "shape": [
          4
        ],
        "fill_value": null,
        "data": [
          -121.62,
          -121.62,
          -121.5,
          -121.5
        ]
      },
      "parameter": {
        "dtype": "string",
        "dims": [
          "index"
        ],
        "shape": [
          4
        ],
        "fill_value": null,
        "data": [
          "pm25",
          "pm25",
          "pm25",
          "pm25"
        ]
      },
      "value": {
        "dtype": "float64",
        "dims": [
          "index"
        ],
        "shape": [
          4
        ],
        "fill_value": null,
        "data": [
          152.3,
          168.7,
          98.1,
          110.4
        ]
      },
      "unit": {
        "dtype": "string",
        "dims": [
          "index"
        ],
        "shape": [
          4
        ],
        "fill_value": null,
        "data": [
          "ug/m3",
          "ug/m3",
          "ug/m3",
          "ug/m3"
        ]
      }
    },
    "coords": {}
  },
  "notes": "OpenAQ-like points CSV. Numeric columns -> float64 1-D arrays; others -> string arrays. Second reader behind the FORMAT registry; proves a non-NetCDF format plugs in unchanged."
}
