{
  "schema": "earthsciio/cache-case/v1",
  "id": "window-wrap",
  "loader": "geosfp",
  "kind": "grid",
  "format": "netcdf",
  "transport": "file",
  "store": "local",
  "resolved_url": "https://data.earthsci.dev/geosfp/mini/GEOSFP.20240101.A3mixed.nc",
  "cache_key": "15b37e1c2dae8dea65eedaab68c5df8f15f007a396dd7b07992ec989588c8aef",
  "blob_path": "cache/v1/blobs/15/15b37e1c2dae8dea65eedaab68c5df8f15f007a396dd7b07992ec989588c8aef.nc",
  "manifest_path": "cache/v1/meta/15b37e1c2dae8dea65eedaab68c5df8f15f007a396dd7b07992ec989588c8aef.json",
  "content_sha256": "292638386e19ce6b969a4f12092e5acbe903ac42c82d224d700a073e589c88b9",
  "bytes": 2216,
  "select": {
    "dims": {
      "lon": {
        "indices": [
          3,
          4,
          0,
          1
        ]
      }
    }
  },
  "decode": {
    "scale_factor_offset": true,
    "fill_to_nan": true,
    "time_decoded": false,
    "decode_time_select": true,
    "select_form": "dims"
  },
  "expected": {
    "variables": {
      "T": {
        "dtype": "float64",
        "dims": [
          "time",
          "lev",
          "lat",
          "lon"
        ],
        "shape": [
          2,
          3,
          4,
          4
        ],
        "fill_value": null,
        "data": [
          [
            [
              [
                250.03,
                250.04,
                250.0,
                250.01
              ],
              [
                250.13,
                250.14,
                250.1,
                250.11
              ],
              [
                250.23,
                250.24,
                250.2,
                250.21
              ],
              [
                250.33,
                250.34,
                250.3,
                250.31
              ]
            ],
            [
              [
                251.03,
                251.04,
                251.0,
                251.01
              ],
              [
                251.13,
                251.14,
                251.1,
                251.11
              ],
              [
                251.23,
                251.24,
                251.2,
                251.21
              ],
              [
                251.33,
                251.34,
                251.3,
                251.31
              ]
            ],
            [
              [
                252.03,
                252.04,
                252.0,
                252.01
              ],
              [
                252.13,
                252.14,
                252.1,
                252.11
              ],
              [
                252.23,
                252.24,
                252.2,
                252.21
              ],
              [
                252.33,
                252.34,
                252.3,
                252.31
              ]
            ]
          ],
          [
            [
              [
                260.03,
                260.04,
                260.0,
                260.01
              ],
              [
                260.13,
                260.14,
                260.1,
                260.11
              ],
              [
                260.23,
                260.24,
                260.2,
                260.21
              ],
              [
                260.33,
                260.34,
                260.3,
                260.31
              ]
            ],
            [
              [
                261.03,
                261.04,
                261.0,
                261.01
              ],
              [
                261.13,
                261.14,
                261.1,
                261.11
              ],
              [
                261.23,
                261.24,
                261.2,
                261.21
              ],
              [
                261.33,
                261.34,
                261.3,
                261.31
              ]
            ],
            [
              [
                262.03,
                262.04,
                262.0,
                262.01
              ],
              [
                262.13,
                262.14,
                262.1,
                262.11
              ],
              [
                262.23,
                null,
                262.2,
                262.21
              ],
              [
                262.33,
                262.34,
                262.3,
                262.31
              ]
            ]
          ]
        ]
      },
      "PS": {
        "dtype": "float64",
        "dims": [
          "time",
          "lat",
          "lon"
        ],
        "shape": [
          2,
          4,
          4
        ],
        "fill_value": null,
        "data": [
          [
            [
              100003.0,
              100004.0,
              100000.0,
              100001.0
            ],
            [
              100013.0,
              100014.0,
              100010.0,
              100011.0
            ],
            [
              100023.0,
              100024.0,
              100020.0,
              100021.0
            ],
            [
              100033.0,
              100034.0,
              100030.0,
              100031.0
            ]
          ],
          [
            [
              101003.0,
              101004.0,
              101000.0,
              101001.0
            ],
            [
              101013.0,
              101014.0,
              101010.0,
              101011.0
            ],
            [
              101023.0,
              101024.0,
              101020.0,
              101021.0
            ],
            [
              101033.0,
              101034.0,
              101030.0,
              101031.0
            ]
          ]
        ]
      },
      "U_EDGE": {
        "dtype": "float64",
        "dims": [
          "time",
          "lat",
          "lon_edge"
        ],
        "shape": [
          2,
          4,
          6
        ],
        "fill_value": null,
        "data": [
          [
            [
              0.5,
              1.5,
              2.5,
              3.5,
              4.5,
              5.5
            ],
            [
              10.5,
              11.5,
              12.5,
              13.5,
              14.5,
              15.5
            ],
            [
              20.5,
              21.5,
              22.5,
              23.5,
              24.5,
              25.5
            ],
            [
              30.5,
              31.5,
              32.5,
              33.5,
              34.5,
              35.5
            ]
          ],
          [
            [
              1000.5,
              1001.5,
              1002.5,
              1003.5,
              1004.5,
              1005.5
            ],
            [
              1010.5,
              1011.5,
              1012.5,
              1013.5,
              1014.5,
              1015.5
            ],
            [
              1020.5,
              1021.5,
              1022.5,
              1023.5,
              1024.5,
              1025.5
            ],
            [
              1030.5,
              1031.5,
              1032.5,
              1033.5,
              1034.5,
              1035.5
            ]
          ]
        ]
      },
      "PHIS": {
        "dtype": "float64",
        "dims": [
          "lat",
          "lon"
        ],
        "shape": [
          4,
          4
        ],
        "fill_value": null,
        "data": [
          [
            3.25,
            4.25,
            0.25,
            1.25
          ],
          [
            13.25,
            14.25,
            10.25,
            11.25
          ],
          [
            23.25,
            24.25,
            20.25,
            21.25
          ],
          [
            33.25,
            34.25,
            30.25,
            31.25
          ]
        ]
      },
      "AREA_LAT": {
        "dtype": "float64",
        "dims": [
          "lat"
        ],
        "shape": [
          4
        ],
        "fill_value": null,
        "data": [
          10.0,
          20.0,
          30.0,
          40.0
        ]
      }
    },
    "coords": {
      "time": {
        "dtype": "int32",
        "data": [
          0,
          3
        ],
        "units": "hours since 2024-01-01 00:00:00",
        "calendar": "standard"
      },
      "lev": {
        "dtype": "float64",
        "data": [
          1.0,
          2.0,
          3.0
        ]
      },
      "lat": {
        "dtype": "float64",
        "data": [
          -1.5,
          -0.5,
          0.5,
          1.5
        ]
      },
      "lon": {
        "dtype": "float64",
        "data": [
          216.0,
          288.0,
          0.0,
          72.0
        ]
      },
      "lon_edge": {
        "dtype": "float64",
        "data": [
          -36.0,
          36.0,
          108.0,
          180.0,
          252.0,
          324.0
        ]
      }
    }
  },
  "notes": "The SAME blob and cache key as named-window-mixed-rank under {dims: {lon: {indices: [3, 4, 0, 1]}}}: a window ACROSS the periodic longitude seam (216, 288, 0, 72), returned in the order given -- the spelling a rank whose halo wraps uses. Applied to `lon` and every field on it; `lon_edge` is a different dimension and stays whole."
}
